{
  "schema_version": "1.0.0",
  "format": "sonicclue-case-archive",
  "case_id": "case-0123456789ab",
  "created_utc": "2026-10-12T12:00:00Z",
  "software_version": "0.1.0",
  "entries": [
    {
      "path": "case.db",
      "size": 40960,
      "sha256": "000000000000000000000000000000000000000000000000000000000000000a"
    }
  ]
}
